Drew_Barrymore	Drew Blythe Barrymore is an American actress, author, director, model and producer.
Durrani_Empire	The Durrani Empire, Durrani Tulukamani, Durrani Wakmani, Durrani Emirate, also called the Sadozai Kingdom and the Last Afghan Empire, was founded in 1747 by Ahmad Shah Durrani with its capital at Kandahar, in present-day Afghanistan.
Family_International	The Family International is a new religious movement that started in 1968 in Huntington Beach, California, USA. It was initially called Teens for Christ and later gained fame as The Children of God. It was later renamed and reorganized as The Family of Love, which eventually was shortened to The Family. It is currently called The Family International.
Hercule_Poirot	Hercule Poirot is a fictional Belgian detective, created by Dame Agatha Christie.
Herman_Boerhaave	Herman Boerhaave was a Dutch botanist, chemist, Christian humanist and physician of European fame.
IBM_AIX	AIX is a series of proprietary Unix operating systems developed and sold by IBM for several of its computer platforms.
Latin_American_Integration_Association	The Latin American Integration Association / Asociación Latinoamericana de Integración / Associação Latino-Americana de Integração is an international and regional scope organization.
Man_Booker_Prize	The Man Booker Prize for Fiction is a literary prize awarded each year for the best original novel, written in the English language and published in the UK. The winner of the Man Booker Prize is generally assured of international renown and success; therefore, the prize is of great significance for the book trade.
Robert_Bellarmine	Saint Robert Bellarmine, S.J. was an Italian Jesuit and a Cardinal of the Catholic Church.
Running_amok	Running amok, sometimes referred to as simply amok or gone amok, also spelled amuk, from the Malay language, is "an episode of sudden mass assault against people or objects usually by a single individual following a period of brooding that has traditionally been regarded as occurring especially in Malay culture but is now increasingly viewed as psychopathological behavior".
Severus_Alexander	Severus Alexander was Roman Emperor from 222 to 235 and the last emperor of the Severan dynasty.
Southeast_Alaska	Southeast Alaska, sometimes referred to as the Alaska Panhandle, is the southeastern portion of the U.S. state of Alaska, which lies west from the northern half of the Canadian province, British Columbia.
Tramlink	Tramlink is a light rail tram system serving Croydon and surrounding areas in South London, England.
Vladimir_Harkonnen	The Baron Vladimir Harkonnen is a fictional character and antagonist from the Dune universe created by Frank Herbert.
Yangtze	The Yangtze River, known in China as the Cháng Jiāng or the Yángzǐ Jiāng, is the longest river in Asia and the third-longest in the world.